{
  "title": "Dev Tech radar",
  "quadrants": [
    {
      "id": "1",
      "name": "Languages & frameworks"
    },
    {
      "id": "2",
      "name": "Platforms"
    },
    {
      "id": "3",
      "name": "Techniques"
    },
    {
      "id": "4",
      "name": "Tools"
    }
  ],
  "rings": [
    {
      "id": "adopt",
      "name": "ADOPT",
      "color": "#93c47d"
    },
    {
      "id": "trial",
      "name": "TRIAL",
      "color": "#93d2c2"
    },
    {
      "id": "assess",
      "name": "ASSESS",
      "color": "#fbdb84"
    },
    {
      "id": "hold",
      "name": "HOLD",
      "color": "#efafa9"
    }
  ],
  "entries": [
    {
      "key": "static-code-analysis",
      "title": "Static code analysis",
      "quadrant": "3",
      "description": "",
      "timeline": [
        {
          "ringId": "adopt",
          "date": "2024-01-01",
          "description": ""
        }
      ]
    },
    {
      "key": "infrastructure-as-code",
      "title": "Infrastructure as code",
      "quadrant": "3",
      "description": "We standardized around Terraform for all our Infrastructure providers (AWS, Azure, GCP)",
      "timeline": [
        {
          "ringId": "adopt",
          "date": "2024-01-01",
          "description": "We standardized around Terraform for all our Infrastructure providers (AWS, Azure, GCP)"
        }
      ]
    },
    {
      "key": "continuous-integration",
      "title": "Continuous integration",
      "quadrant": "3",
      "description": "",
      "timeline": [
        {
          "ringId": "adopt",
          "date": "2024-01-01",
          "description": ""
        }
      ]
    },
    {
      "key": "unit-testing",
      "title": "Unit Testing",
      "quadrant": "3",
      "description": "",
      "timeline": [
        {
          "ringId": "adopt",
          "date": "2024-01-01",
          "description": ""
        }
      ]
    },
    {
      "key": "static-security-testing",
      "title": "Static security testing",
      "quadrant": "3",
      "description": "",
      "timeline": [
        {
          "ringId": "adopt",
          "date": "2024-01-01",
          "description": ""
        }
      ]
    },
    {
      "key": "log-aggregation",
      "title": "Log aggregation",
      "quadrant": "3",
      "description": "",
      "timeline": [
        {
          "ringId": "adopt",
          "date": "2024-01-01",
          "description": ""
        }
      ]
    },
    {
      "key": "microservices",
      "title": "Microservices",
      "quadrant": "3",
      "description": "",
      "timeline": [
        {
          "ringId": "adopt",
          "date": "2024-01-01",
          "description": ""
        }
      ]
    },
    {
      "key": "standardized-code-reviews",
      "title": "Standardized code reviews",
      "quadrant": "3",
      "description": "Although most of our projects are covered by code reviews, having a standardized reviewing process (aggregating from the best practices across all our projects) will allow us to improve the quality of the development process and deliver a consistent experience to our customers. Detailed reasoning in internal decision record ZDR-0002.",
      "timeline": [
        {
          "ringId": "trial",
          "date": "2024-01-01",
          "description": "Although most of our projects are covered by code reviews, having a standardized reviewing process (aggregating from the best practices across all our projects) will allow us to improve the quality of the development process and deliver a consistent experience to our customers. Detailed reasoning in internal decision record ZDR-0002."
        }
      ]
    },
    {
      "key": "serverless",
      "title": "Serverless",
      "quadrant": "3",
      "description": "",
      "timeline": [
        {
          "ringId": "trial",
          "date": "2024-01-01",
          "description": ""
        }
      ]
    },
    {
      "key": "dora-four-key-metrics",
      "title": "DORA Four Key Metrics",
      "quadrant": "3",
      "description": "",
      "timeline": [
        {
          "ringId": "assess",
          "date": "2024-01-01",
          "description": ""
        }
      ]
    },
    {
      "key": "ansible",
      "title": "Ansible",
      "quadrant": "4",
      "description": "Ansible's role has been significantly diminished and will no longer be used for config management at the VM level (given that most projects now run on Kubernetes). However, we will keep using Ansible to deploy certain Helm charts inside Kubernetes clusters.",
      "timeline": [
        {
          "ringId": "adopt",
          "date": "2024-01-01",
          "description": "Ansible's role has been significantly diminished and will no longer be used for config management at the VM level (given that most projects now run on Kubernetes). However, we will keep using Ansible to deploy certain Helm charts inside Kubernetes clusters."
        }
      ]
    },
    {
      "key": "git",
      "title": "Git",
      "quadrant": "4",
      "description": "",
      "timeline": [
        {
          "ringId": "adopt",
          "date": "2024-01-01",
          "description": ""
        }
      ]
    },
    {
      "key": "gitlab-ci/cd",
      "title": "GitLab CI/CD",
      "quadrant": "4",
      "description": "",
      "timeline": [
        {
          "ringId": "adopt",
          "date": "2024-01-01",
          "description": ""
        }
      ]
    },
    {
      "key": "new-relic",
      "title": "New Relic",
      "quadrant": "4",
      "description": "",
      "timeline": [
        {
          "ringId": "adopt",
          "date": "2024-01-01",
          "description": ""
        }
      ]
    },
    {
      "key": "redis",
      "title": "Redis",
      "quadrant": "4",
      "description": "",
      "timeline": [
        {
          "ringId": "adopt",
          "date": "2024-01-01",
          "description": ""
        }
      ]
    },
    {
      "key": "webpack",
      "title": "Webpack",
      "quadrant": "4",
      "description": "",
      "timeline": [
        {
          "ringId": "adopt",
          "date": "2024-01-01",
          "description": ""
        }
      ]
    },
    {
      "key": "varnish",
      "title": "Varnish",
      "quadrant": "4",
      "description": "Will be used mainly on Magento projects",
      "timeline": [
        {
          "ringId": "adopt",
          "date": "2024-01-01",
          "description": "Will be used mainly on Magento projects"
        }
      ]
    },
    {
      "key": "looker-data-studio",
      "title": "Looker Data Studio",
      "quadrant": "4",
      "description": "",
      "timeline": [
        {
          "ringId": "adopt",
          "date": "2024-01-01",
          "description": ""
        }
      ]
    },
    {
      "key": "powerbi",
      "title": "PowerBI",
      "quadrant": "4",
      "description": "PowerBI is a business analytics tool that provides interactive visualizations and BI capabilities with an interface that is easy to use for creating reports and dashboards. We like PowerBI because it supports a large number of data sources and offers a significant number of highly customizable reports and dashboards. We also like its ability to connect directly to data sources through DirectQuery. We will be using PowerBI for all our BI needs when the data warehouse/data source is in Azure.",
      "timeline": [
        {
          "ringId": "adopt",
          "date": "2024-01-01",
          "description": "PowerBI is a business analytics tool that provides interactive visualizations and BI capabilities with an interface that is easy to use for creating reports and dashboards. We like PowerBI because it supports a large number of data sources and offers a significant number of highly customizable reports and dashboards. We also like its ability to connect directly to data sources through DirectQuery. We will be using PowerBI for all our BI needs when the data warehouse/data source is in Azure."
        }
      ]
    },
    {
      "key": "github-copilot",
      "title": "GitHub Copilot",
      "quadrant": "4",
      "description": "GitHub Copilot is an AI-powered code assistant that promises to automate repetitive code writing tasks, while also being able to generate small blocks of code based on context. Although we feel like using Copilot incurs some extra debugging time, the experience seems to be net positive and we're inclined to recommend its adoption at the company level given the reasonable pricing. Adoption progress documented in internal decision record ZDR-0005.",
      "timeline": [
        {
          "ringId": "adopt",
          "date": "2024-01-01",
          "description": "GitHub Copilot is an AI-powered code assistant that promises to automate repetitive code writing tasks, while also being able to generate small blocks of code based on context. Although we feel like using Copilot incurs some extra debugging time, the experience seems to be net positive and we're inclined to recommend its adoption at the company level given the reasonable pricing. Adoption progress documented in internal decision record ZDR-0005."
        }
      ]
    },
    {
      "key": "azure-devops",
      "title": "Azure DevOps",
      "quadrant": "4",
      "description": "",
      "timeline": [
        {
          "ringId": "trial",
          "date": "2024-01-01",
          "description": ""
        }
      ]
    },
    {
      "key": "aws-code-deploy",
      "title": "AWS Code Deploy",
      "quadrant": "4",
      "description": "Given that we standardized the code deployment process around Kubernetes + GitLab CI or Azure DevOps Pipelines, AWS CodeDeploy is not longer necessary even for AWS-based projects.",
      "timeline": [
        {
          "ringId": "hold",
          "date": "2024-01-01",